{
  "schema_version": "1.1.0",
  "work_item_id": null,
  "status": "idle",
  "observations_count": 0,
  "consecutive_no_progress": 0,
  "last_progress_fingerprint": null,
  "last_metrics": null,
  "last_material_change": null,
  "last_failure_fingerprint": null,
  "same_failure_count": 0,
  "owner_decision_required": false,
  "owner_decision_reason": null,
  "updated_at_utc": null,
  "history": []
}
